{
  "$schema": "oebf://schema/0.1/opening",
  "id": "opening-window-north-gf",
  "type": "Opening",
  "description": "Window, north wall, ground floor, centre x = 4.5 m, head at 2.6 m",
  "host_element_id": "element-wall-north-gf",
  "path_id": "path-wall-north-gf",
  "path_position": 3.6,
  "width_m": 1.8,
  "height_m": 1.7,
  "sill_height_m": 0.75,
  "ifc_type": "IfcWindow"
}
