{
  "$schema": "oebf://schema/0.1/opening",
  "id": "opening-window-south-gf-1",
  "type": "Opening",
  "description": "Window, south wall, ground floor, centre x = 1.894 m, 506 mm from the grid line 2 CLT wall",
  "host_element_id": "element-wall-south-gf",
  "path_id": "path-wall-south-gf",
  "path_position": 6.506,
  "width_m": 1.2,
  "height_m": 1.2,
  "sill_height_m": 0.75,
  "ifc_type": "IfcWindow"
}
